text	subject	label																																																																																																																																																											
"United Airlines - United MileagePlus Enter the United Packages sweepstakes by June 14. View Online MileagePlus # XXXXX768 Mileage balance 1,600 MileagePlus # XXXXX768 Mileage balance 1,600 MileagePlus # XXXXX768 Mileage balance 1,600 Sign up for your chance to win with United Packages. Sign up to receive email updates from United Packages and you'll be entered for a chance to win a trip for 2 to Cancun, including airfare and more.Enter by June 14 for a chance to win this incredible package deal: 4 nights in a Deluxe Seaside room at the Kempinski Hotel Cancun Roundtrip flights from the U.S. (excluding Alaska and Hawaii) to Cancun Breakfast each day during your stay Airport transfer to and from the hotel No matter what, you're always a winner when you bundle your flight, hotel and car rental with United Packages. Sign up now Discover Kempinski Hotel Cancun Located in front of a pristine white sand beach, this 5-star hotel is the epitome of luxury and hospitality. Offering a collection of rooms that all have spectacular ocean views, 6 unique restaurants and bars on site, deluxe spa services available and much more. Already a United Packages subscriber? You can still enter to win this dream vacation. Just visit the entry page to fill out the required information and you'll be entered into the sweepstakes. Reservations Deals & offers MileagePlus® My United Terms and conditions: One (1) prize will be available to be awarded in this Sweepstakes. The prize winner (""Winner"") will receive a five (5) day, four (4) night trip for Winner and Guest (""Guest(s)"") to Kempinski Hotel Cancun, Mexico (""Trip""). Trip will include: Stay for two people in a Deluxe Seaside room and breakfast for two people during the stay (Resort fee and Sanitation fee are not included). Trip also includes roundtrip United Airlines economy airfare for the Winner and Guest, in Booking Class H or lower, to Cancun, MX from the 48 contiguous United States or D.C. (excluding Alaska and Hawaii) collectively (""Prize""). The Approximate Retail Value (""ARV"") of the Prize is $4,160.00.NO PURCHASE NECESSARY. A PURCHASE DOES NOT IMPROVE ONE'S CHANCES OF WINNING. VOID WHERE PROHIBITED BY LAW. Open only to permanent, legal residents of the 50 United States and the District of Columbia who are physically located and residing therein (excluding Puerto Rico, Guam, U.S. Virgin Islands and U.S. Territories) who are 18 years of age or older. Sweepstakes runs from 9:00:00 a.m. ET on 05/01/2024 to 11:59:59 p.m. ET on 06/14/2023. Air transportation only offered from the 48 contiguous United States or the District of Columbia. Limit one (1) Entry per person/per email address during the Sweepstakes Period. To enter, for official rules, odds of winning, blackout dates, and prize details, see Official Rules: https://packages.united.com/wl/email/signup/sweepstakes/2024-cancun-sweepstakes/#terms-and-conditionsSponsor: priceline.com LLC. Grupo Inmobiliario MOSA DBA Kempinski Hotel Cancun and/or United Airlines are not sponsors, or administrators of the sweepstakes. 841282 ET02 20240501 fdbdf435d9ab3d2a02b2efc49bde5b63 This email was sent to erinsalik@gmail.com by United Airlines. Please do not reply to this email. We cannot accept electronic replies to this email address. © 2024 United Airlines, Inc. and/or Mileage Plus Intellectual Property Assets, Ltd. All rights reserved. United Airlines, Inc. 233 S. Wacker Drive Chicago, IL 60606Contact us | Unsubscribe | Email preferences | Privacy policy Download the latest United app "	Win a 4-night stay in Cancun at the Kempinski Hotel	spam																																																																																																																																																											
"Rupa HealthHi Erin, we received your lab testing payment!Thank you for your $108.41 lab testing payment. We prepared your itemized receipt for the tests ordered through Rupa, just for you.Download Itemized ReceiptTrack Your OrderLook out for an email with next steps and instructions on how to collect your sample.We hope you have a great day!Cheers,The Rupa Health TeamHave any questions? Message us in your secure Patient Portal."	Thank you for your payment!	invoice																																																																																																																																																											
"Our Carmel Slim Arm Sofa sets the scene New York | 212-488-6280 *Promotional Exclusions: Offers may not be combined with any other coupons, discounts or offers including associate discounts or mall coupon books. Promotions are subject to changes. Exclusions may apply. Click here for details. Sale quantities are limited and all sales final on items with prices ending in $.97 or $.99. Offers are valid in the US only and prices are listed in US dollars. Promotions and sale pricing not valid on items delivered by our in-home delivery services, previous purchases, gift cards, taxes, monogramming, shipping or processing charges, and may not be combined with any other coupons, discounts or offers including associate discounts or mall coupon books. Promotions are subject to change at any time. Offers not valid at PBteen, Pottery Barn Kids, or Pottery Barn Outlet unless explicitly stated and cannot be sold or otherwise bartered. Print or show this email on your mobile device to redeem discounts in store. EARNING REWARDS & USING YOUR CARD1New customers earn an additional 5% back in Reward Dollars for purchases made at Williams-Sonoma, Inc. Brands (excluding Rejuvenation and GreenRow) during the first 30 days from account opening.2Promotional financing available on qualifying purchases of $750 or more, excluding shipping and tax, made on an approved Pottery Barn Key Rewards, Williams Sonoma Key Rewards, West Elm Key Rewards or The Key Rewards Visa or Store Card, issued by Capital One, N.A. Your account must be open and current to be eligible for this offer. For eligible purchases, the purchase amount is divided into 12 equal monthly payments and will be assessed a 0% APR effective for 12 months or until the purchase is paid in full. This special repayment term will be added to your normal minimum payment due on nonpromotional Credit Plans. If you do not make the suggested equal payments under the program and the purchase is not paid in full after 12 months, the standard variable purchase APR of 30.24%-31.24% will apply to your remaining program balance. The advertised monthly payment amount is rounded to the nearest dollar, and does not include taxes, shipping or ancillary charges. Promotional financing availability may be limited in certain stores. Rewards are not earned on promotional financing purchases. Purchases made through third-party payment accounts, mobile or wireless card readers, mobile or digital wallets, or similar technology, are not eligible to receive promotional financing. Key Rewards Visa: Purchase APR: 30.24% variable; Balance Transfer APR: 30.24% variable; Cash Advance APR: 30.24% variable. Cash Advance Fee: greater of 5% of advance amount or $5; Balance Transfer Fee: 3% of the amount of each transferred balance that posts to your account. Key Rewards Card: Purchase APR: 31.24% variable. Variable APRs as of 9/25/23. Subject to credit approval; based on your creditworthiness, some options may not be available and other terms may apply. Visa is a registered trademark of Visa International Service Association. 3Rewards earnings are subject to the Key Gold Rewards Terms and Credit Card Terms in Customer Agreement. Cardholders Earn 5% in Reward Dollars for each $1.00 of Net Eligible Purchases made on your Card at Williams Sonoma, Williams Sonoma Home, Pottery Barn, Pottery Barn Kids, Pottery Barn Teen, West Elm, and Mark & Graham stores, catalogs, or online (collectively referred to as ""Williams Sonoma Stores""). Rates from 036% APR. Payment options through Affirm are subject to an eligibility check and are provided by these lending partners: affirm.com/lenders. Options depend on your purchase amount, and a down payment may be required. See affirm.com/licenses for important info on state licenses and notifications. To ensure delivery to your inbox, add PotteryBarn@e.potterybarn.com to your address book. Click here to unsubscribe or manage your email preferences. Click here to read our privacy policy. © Pottery Barn, Direct Marketing, 3250 Van Ness Ave., San Francisco, CA 94109.This message was sent to: erinsalik@gmail.comView in browser"	How to create a relaxed living room	spam																																																																																																																																																											
"Were NYT Wirecutters pick for BEST flower delivery!Easy to order, reliable, and high end florals FLOWERSBEST SELLERSSALESUBSCRIPTIONSFLOWERSBEST SELLERSSALESUBSCRIPTIONS 1615 L Street NW, Suite 200, Washington, DC 20036 care@urbanstems.com | (855) 61-HAPPY © 2024 UrbanStems Inc.You can unsubscribe from this list."	Were NYT Wirecutters pick for BEST flower delivery!	spam																																																																																																																																																											
"The season's it-shade. NewClothesBeauty & WellnessAccessoriesIntimatesShoesSaleYou are subscribed as erinsalik@gmail.comUnsubscribe Privacy PolicyFree Express Shipping for US and Australia orders over $150 valid on the Free People App. Valid to all US and Australia addresses for a limited time only. Express orders placed after 1 PM EST will ship the next business day. Express Shipping must be selected during checkout before completing your order. Does not apply to any duty/tax due on delivery.Free Returns on all US orders. Valid for a limited time only. Additional fees apply for Express and Overnight delivery options. Click here to view current promotions. View in a browserFree People Direct Customer Service5000 S. Broad St., Philadelphia, PA 19112 © 2024 URBN US Retail, LLC. All Rights Reserved."	This set = a free-est fav ??	spam																																																																																																																																																											
" Save 20% on 5+ items with code 20SPRING ? ? ? ? ? ? ? ? ? ? ? ? ? ? ? ? ? ? ? ? ? ? ? ? ? ? ? ? ? ? ? ? ? ? ? ? ? ? ? ? ? ? ? ? ? ? ? ? ? ? ? ? ? ? ? ? ? ? ? ? ? ? ? ? ? ? ? ? ? ? ? ? ? ? ? ? ? ? ? ? ? ? ? ? ? ? ? ? ? ? ? ? ? ? ? ? ? ? ? ? ? ? ? ? ? ? ? ? ? ? ? ? ? ? ? ? ? ? ? ? ? ? ? ? ? ? ? ? ? ? ? ? ? ? ? ? ? ? ? ? ? ? ? ? ? ? ? ? ? ? ­ ­ ­ ­ ­ ­ ­ ­ ­ ­ ­ ­ ­ ­ ­ ­ ­ ­ ­ ­ ­ ­ ­ ­ ­ ­ ­ ­ ­ ­ ­ ­ ­ ­ ­ ­ ­ ­ ­ ­ ­ ­ ­ ­ ­ ­ ­ ­ ­ ­ ­ ­ ­ ­ ­ ­ ­ ­ ­ ­ ­ ­ ­ ­ ­ ­ ­ ­ ­ ­ ­ ­ ­ ­ ­ ­ ­ ­ ­ ­ ­ ­ ­ ­ ­ ­ ­ ­ ­ ­ ­ ­ ­ ­ ­ ­ ­ ­ ­ ­ ­ ­ ­ ­ ­ ­ ­ ­ ­ ­ ­ ­ ­ ­ ­ ­ ­ ­ ­ ­ ­ ­ ­ ­ ­ ­ ­ ­ ­ ­ ­ ­ ­ ­ ­ ­ ­ ­ ­ ­ ­ ­ ­ ­ ­ ­ ­ ­ ­ ­ Enjoy 20% OFF 5+ full price items with code 20SPRING ?Cotton gauze tank dress in rainbow garden party$38.00 $30.40with code 20SPRINGCotton gauze swing dress$34.00 $27.20with code 20SPRINGCotton gauze tiered dress in rainbow starfish$44.00 $35.20with code 20SPRINGCotton gauze beach short in rainbow garden party$28.00 $22.40with code 20SPRINGCotton gauze tank jumpsuit in rainbow beach balls$44.00 $35.20with code 20SPRINGCotton gauze beach short in rainbow beach balls$28.00 $22.40with code 20SPRINGCotton gauze short sleeve button down in rainbow beach balls$38.00 $30.40with code 20SPRING Shop all gauze Sun hat in rainbow sky stripe$22.50 $15.75Swim board short in pinwheels$29.50 $20.50Swim trunk in rainbow sky stripe$29.50 $20.50 Promotion code 20SPRING requires 5+ full-price items in the order, and a 20% discount will then apply to all full-price items in the order. Multi-pack and bundle styles count as 1 item in the order. Cannot be combined with other offers or codes. All promotions are limited time only, while supplies last. Sale prices as marked and subject to change. Promotions and discounts may not be used for the purchase of digital gift cards. Primary reserves the right to modify or cancel promotions at any time.©Primary Kids Inc. 2024530 7th Ave. Suite 1902 New York, NY 10018This email was sent to erinsalik@gmail.com.Get Less Email | Unsubscribe | Refer a FriendView in Browser"	Summer's favorite fabric is back! ????	spam																																																																																																																																																											
