text	subject	label																																																																																																																																																											
" ECCO | Summer together in ECCO COZMOs Step into sandal season with new comfort ? ? ? ? ? ? ? ? ? ? ? ? ? ? ? ? ? ? ? ? ? ? ? ? ? ? ? ? ? ? ? ? ? ? ? ? ? ? ? ? ? ? ? ? ? ? ? ? ? ? ? ? ? ? ? ? ? ? ? ? ? ? ? ? ? ? ? ? ? ? ? ? ? ? ? ? ? ? ? ? ? ? ? ? ? ? ? ? ? ? ? ? ? ? ? ? ? ? ? ? ? ? ? ? ? ? ? ? ? ? ? ? ? ? ? ? ? ? ? ? ? ? ? ? ? ? ? ? ? ? ? ? ? ? ? ? ? ? ­ ­ ­ ­ ­ ­ ­ ­ ­ ­ ­ ­ ­ ­ ­ ­ ­ ­ ­ ­ ­ ­ ­ ­ ­ ­ ­ ­ ­ ­ ­ ­ ­ ­ ­ ­ ­ ­ ­ ­ ­ ­ ­ ­ ­ ­ ­ ­ ­ ­ ­ ­ ­ ­ ­ ­ ­ ­ ­ ­ ­ ­ ­ ­ ­ ­ ­ ­ ­ ­ ­ ­ ­ ­ ­ ­ ­ ­ ­ ­ ­ ­ ­ ­ ­ ­ ­ ­ ­ ­ ­ ­ ­ ­ ­ ­ ­ ­ ­ ­ ­ ­ ­ ­ ­ ­ ­ ­ ­ ­ ­ ­ ­ ­ ­ ­ ­ ­ ­ ­ ­ ­ ­ ­ ­ ­ ­ ­ ­ ­ ­ ­ ­ ­ ­ ­ ­ ­ Buy now. Pay with Klarna.View in browserMenWomenOutdoorGolfSaleMemories and Moments Wherever your summer adventure takes you, embrace the little moments. Discover the new collection of ECCO COZMO - Nordic-inspired sandals crafted for unforgettable experiences. Discover ECCO COZMO Minimalistic Aesthetic Discover sandals and clogs from the new ECCO COZMO collection. Minimalist designs with wear-anywhere appeal, in a range of summer shades.Shop Men'sShop Women'sYour Off-Duty Companion Get ready to explore near and far this summer with the ECCO Pot Bag, featuring a leather strap for hands-free adventures. Discover The Pot BagFree Shipping Don't forget, your ECCO account comes with perks like free shipping, special offers and more.Sign InShop by CategoryMenWomenKidsGolfOutdoorFollow us on socialCustomer ServiceAbout Us Services PoliciesYou have received this email to ahm203@yahoo.com, because you have signed up for our ECCO Newsletter. If you would prefer to no longer receive emails from ECCO please unsubscribe, here. This message was sent by: ECCO US, 16 Delta Drive, Londonderry, NH 03053.© ECCO. All rights reserved"	Summer together in ECCO COZMOs	spam																																																																																																																																																											
" Hello Anthony, Thank you for shopping with us. Well send a confirmation when your items ship. Order Confirmation Arriving: Thursday, May 2, 7 a.m.  11 a.m. Ship to: Anthony BROOKLYN, NY Order # 111-8099591-2471422 View or manage order Dr. Killigan's Premium Clot... Qty : 2 Order Total: $54.38 Recommended for you based on items in your orderCedar Chips and Lavender Sachets (20...$19.95Belinlen 3 Pack 60"" Long Garment Bags...$20.99 The payment for your invoice is processed by Amazon Payments, Inc. P.O. Box 81226 Seattle, Washington 98108-1226. If you need more information, please contact (866) 216-1075 By placing your order, you agree to Amazon.coms Privacy Notice and Conditions of Use. Unless otherwise noted, items sold by Amazon.com are subject to sales tax in select states in accordance with the applicable laws of that state. If your order contains one or more items from a seller other than Amazon.com, it may be subject to state and local sales tax, depending upon the seller's business policies and the location of their operations. Learn more about tax and seller information. This email was sent from a notification-only address that cannot accept incoming email. Please do not reply to this message. "	"Your Amazon.com order of 2 x ""Dr. Killigan's Premium...""."	invoice																																																																																																																																																											
" HI ERIN, YOUR MY PLACE REWARDS POINT BALANCE: -100 LOG IN $10 OFF $20your next online order with code*Web Code: Y64005IZCL11ILValid online through 05/31/2024 Gift Cards | My Account | Customer Service | Privacy | StoresCONNECT WITH US *Valid through 05/31/2024. Valid at childrensplace.com, gymboree.com, and on The Childrens Place, Inc. official mobile apps only. Valid on qualifying orders shipped within the U.S. and Puerto Rico only. Not valid in stores. Valid on The Childrens Place, Gymboree, Sugar & Jade and PJ Place branded merchandise only. Purchase must total the specified amount or more, net of gift card purchases, applicable discounts or promotions and before sales tax and shipping fees are applied. Eligible purchase amount is the transaction total for merchandise and gift wrap products after any coupons or other discounts are applied, and minus any returns, refunds or credit adjustments, and does NOT include taxes, shipping, or purchases of gift cards. Valid for one-time use only. Limit one coupon per transaction. Not valid toward purchase of gift cards, previously purchased merchandise, credit card payments or licensed or third-party branded products. Cannot be redeemed in a closing store, in conjunction with any in-store or online site-wide percentage-off event or on bulk purchases. Coupons are not redeemable for cash or merchandise credit and have no cash value. Returns and exchanges are subject to discount taken at time of redemption. May not be purchased, duplicated, traded or sold. Only original coupons will be accepted. Valid coupon code must be provided at checkout. Offer will not be re-issued if lost, stolen, corrupted or destroyed or with return/refund of merchandise. Internet distribution strictly prohibited.Not valid in conjunction with The Childrens Place associate discount. Cannot be combined with any offer except My Place Rewards certificates. Use of coupon is acceptance of its terms. Offer may be cancelled or modified by The Childrens Place, Inc. at any time. Void where prohibited.MY PLACE REWARDS MEMBER POINTS BALANCE Total may not reflect all transactions in the last 48 hours.Please take a moment to add TheChildrensPlace@email.childrensplace.com to your address book.This email was sent to erinsalik@gmail.com because you requested to receive marketing messages from The Children's Place. You can withdraw your consent at any time. To update your email preferences or to unsubscribe, click here.UPDATE EMAIL PREFERENCES | UNSUBSCRIBE | PRIVACY POLICY | CONTACT US© 2024 The Children's Place, Inc. All rights reserved.The Children's Place, Inc., 500 Plaza Drive, Secaucus, NJ 07094, USFor customer service, please visit our contact us page or call us at 1-877-752-2387. "	"Erin, heres $10 + check out whats new!"	spam																																																																																																																																																											
"Misfits MarketCheck out everything that's new and stock up on essentials ? ? ? ? ? ? ? ? ? ? ? ? ? ? ? ? ? ? ? ? ? ? ? ? ? ? ? ? ? ? ? ? ? ? ? ? ? ? ? ? ? ? ? ? ? ? ? ? ? ? ? ? ? ? ? ? ? ? ? ? ? ? ? ? ? Shop organic produce, sustainably sourced groceries, and fun new finds - and get 50% off your next two orders* (up to $20) with code MMLT514. Fill up your cart by Saturday, May 04 at 11:45 PM ET to place an order. Shop Now Explore deals in our aislesShop FruitShop VeggiesShop PantryShop Dairy & EggsShop Nowyour next two orders* (up to $20)Shop nowUse code: MMLT514 *Offer valid only for the recipient of this email. The 50% discount can only be applied on your next two orders. Maximum $20 discount. Code MMLT514 must be claimed by 5/7/2024 at 11:59pm ET and must be fully used by 5/14/2024 at 11:59pm ET. Once claimed, the discount will be automatically applied to your next two orders. Your order delivery dates must be on or before the expiration date for the discount to be applicable. © 2024 Misfits Market, Inc, All Rights Reserved16800 SE Evelyn Street, Suite 140, Clackamas, OR 97015Manage My Preferences | Unsubscribe | Terms of Service | Privacy Policy"	Order again and get 50% off your next 2 orders ??	spam																																																																																																																																																											
"TJX REWARDS®Offer ends 5/31. Learn how. HEY, ERINOffer ends 5/31*Purchases are subject to credit approval. In order to qualify for this offer, qualifying purchases must be made 4/15/24 at 12:00am ET through 5/31/24 at 11:59pm ET. Many merchants may wait for a purchase to ship before they charge the purchase to your account which may result in a transaction date outside the offer period. Offer is not valid on purchases with a transaction date outside the offer period. A maximum of 1,000 bonus points can be earned with this offer. Account must remain open, in good standing and not be delinquent at the time the bonus points are posted to the Account. Please allow up to two billing periods after the promotional period ends for bonus points to post to your Account. This offer is not transferable and only one offer per account. See your Rewards Program Terms for details on earning and redeeming rewards. TJX Rewards Mastercards are issued by Synchrony Bank pursuant to a license by Mastercard International Incorporated. Mastercard, World Mastercard and the circles design are registered trademarks of Mastercard International Incorporated.The Contactless Indicator mark, consisting of four graduating arcs, is a trademark owned by and used with permission of EMVCo, LLC.Head off identity theft before it happens. For more information about identity theft, please visit Federal Trade Commission's (FTC) consumer website.Add cardholder@e.synchronyfinancial.com to your address book to ensure email delivery.Having trouble seeing this email? Click here to view in browser.This is an unmonitored email box. Please do not reply to this email.This email was sent by Synchronys TJX Rewards Credit Services Division. Credit is extended by Synchrony Bank, which is located at 170 Election Road, Suite 125, Draper, UT 84020-6425, USA. www.synchrony.comUnsubscribe: If you no longer wish to receive email marketing communications from Synchrony's TJX Rewards Credit Services Division, click here to unsubscribe.8672462_TJXDRETDE02XXXXTX01A_TJX"	 ERIN  you can still earn 10X Rewards Points!	spam																																																																																																																																																											
" PDW May the 4th New SPD X Strider Knives  Ti-Hex Tags  Mini-Figs  Morale Patches ? ? ? ? ? ? ? ? ? ? ? ? ? ? ? ? ? ? ? ? ? ? ? ? ? ? ? ? ? ? ? ? ? ? ? ? ? ? ? ? ? ? ? ? ? ? ? ? ? ? ? ? ? ? ? ? ? ? ? ? ? ? ? ? ? ? ? ? ? ? ? ? ? ? ? ? ? ? ? ? ? ? ? ? ? ? ? ? ? ? ? ? ? ? ? ? ? ? ? ? ? ? ? ? ? ? ? ? ? ? ? ? ? ? ? ? ? ? ? ? ? ? ? ? ? ? ? ? ? ? ? ? ? ? ? ? ? ? ? ? ? ? ? ? ? ? ? ? ? ? ­ ­ ­ ­ ­ ­ ­ ­ ­ ­ ­ ­ ­ ­ ­ ­ ­ ­ ­ ­ ­ ­ ­ ­ ­ ­ ­ ­ ­ ­ ­ ­ ­ ­ ­ ­ ­ ­ ­ ­ ­ ­ ­ ­ ­ ­ ­ ­ ­ ­ ­ ­ ­ ­ ­ ­ ­ ­ ­ ­ ­ ­ ­ ­ ­ ­ ­ ­ ­ ­ ­ ­ ­ ­ ­ ­ ­ ­ ­ ­ ­ ­ ­ ­ ­ ­ ­ ­ ­ ­ ­ ­ ­ ­ ­ ­ ­ ­ ­ ­ ­ ­ ­ ­ ­ ­ ­ ­ ­ ­ ­ ­ ­ ­ ­ ­ ­ ­ ­ ­ ­ ­ ­ ­ ­ ­ ­ ­ ­ ­ ­ ­ ­ ­ ­ ­ ­ ­ ­ ­ ­ ­ ­ ­ ­ ­ ­ ­ ­ ­ INSTOCK APPAREL SOFT-GOODS EDC TOOLS ACCESSORIES INSTOCK APPAREL SOFT-GOODS EDC TOOLS ACCESSORIES Copyright © 2023 Prometheus Design Werx. All rights reserved.Prevent unauthorized purchases from fraudulent websites by shopping exclusively on our official website, www.prometheusdesignwerx.com, or through our authorized dealers. Our support email is: support@prometheusdesignwerxcomWant to change how you receive these emails?You can Manage Preferences? , or Unsubscribe here. Copyright © 2023 Prometheus Design Werx. All rights reserved.Prevent unauthorized purchases from fraudulent websites by shopping exclusively on our official website, www.prometheusdesignwerx.com, or through our authorized dealers. Our support email is: support@prometheusdesignwerxcomWant to change how you receive these emails?You can Manage Preferences? , or Unsubscribe here. "	PDW May the 4th New SPD X Strider Knives  Ti-Hex Tags  Mini-Figs  Morale Patches	spam																																																																																																																																																											
" Order through today to get by Mother's Day? ? ? ? ? ? ? ? ? ? ? ? ? ? ? ? ? ? ? ? ? ? ? ? ? ? ? ? ? ? ? ? ? ? ? ? ? ? ? ? ? ? ? ? ? ? ? ? ? ? ? ? ? ? ? ? ? ? ? ? ? ? ? ? ? ? ? ? ? ? ? ? ? ? ? ? ? ? ? ? ? ? ? ? ? ? ? ? ? ? ? ? ? ? ? ? ? ? ? ? ? ? ? ? ? ? ? ? ? ? ? ? ? ? ? ? ? ? ? ? ? ? ? ? ? ? ? ? ? ? ? ? ? ? ? ? ? ? ? ? ? ? ? ? ? ? ? ? ? ? ? ­ ­ ­ ­ ­ ­ ­ ­ ­ ­ ­ ­ ­ ­ ­ ­ ­ ­ ­ ­ ­ ­ ­ ­ ­ ­ ­ ­ ­ ­ ­ ­ ­ ­ ­ ­ ­ ­ ­ ­ ­ ­ ­ ­ ­ ­ ­ ­ ­ ­ ­ ­ ­ ­ ­ ­ ­ ­ ­ ­ ­ ­ ­ ­ ­ ­ ­ ­ ­ ­ ­ ­ ­ ­ ­ ­ ­ ­ ­ ­ ­ ­ ­ ­ ­ ­ ­ ­ ­ ­ ­ ­ ­ ­ ­ ­ ­ ­ ­ ­ ­ ­ ­ ­ ­ ­ ­ ­ ­ ­ ­ ­ ­ ­ ­ ­ ­ ­ ­ ­ ­ ­ ­ ­ ­ ­ ­ ­ ­ ­ ­ ­ ­ ­ ­ ­ ­ ­ ­ ­ ­ ­ ­ ­ ­ ­ ­ ­ ­ ­ BaubleBar's May Sitewide Event is valid on baublebar.com from 4/26/24 at 8AM EST through 5/5/24 at 11:59PM EST. Receive a 20% discount sitewide. Discount will apply automatically at checkout. Exclusions include but are not limited to $10 Deals, Maya Brenner, Gift Cards, Gift Pouches, Packaging, and minibar live ship. This promo cannot be combined with other promotions or discount codes. It has no cash value and cannot be applied to previous purchases - price adjustments will not be offered. BaubleBar reserves the right to extend, modify, or discontinue this offer at any time without notice. To ensure delivery to your inbox, please add baublebar@bb.baublebar.com to your address book. Contact UsCan't see these images? View in your browserNo longer want to receive these emails? Unsubscribe.© 2024 BaubleBar, all rights reserved"	Last Chance: 20% OFF GIFTS	spam																																																																																																																																																											
"Scary Mommy 5/1/2024One of our faves stops by to say hi. May. 1, 2024FAMILY Alyce Chan Is In The Parenting Sweet SpotI know many of you are familiar with Alyce Chans hysterical work on social media as @momcomnyc, because shes a fixture on Scary Mommys very own Instagram. Shes hilarious on being a mom, being in a relationship, and just being a person, too. And I recently got a chance to chat with her on Zoom about her stand-up career and how her mom humor has changed the vibe with her audience, what her kids make of her comedy, and why the elementary years are the parenting sweet spot. Also, why hecklers can be fun! (Sometimes, anyway.) Give it a read.Kelly Faircloth, Executive EditorRead More ?LatestDOING IT RIGHTA Doorbell Camera Has Captured The Ideal Mother-In-LawA mom shared footage of why she loves when her MIL visits so much.Read More.Zeljkosantrac/Getty ImagesNO ONE TOLD MECapsule Wardrobes Are A F*cking Scam. Heres Why.Especially for moms, our writer argues!Read More.IT'S TRUEMom Says Voluntarily Involved Grandparents Are The Biggest Game-Changer For ParentsIt isn't the mom car, not how much you make a year. It's not how well-behaved your kids are. The biggest flex is having involved grandparents.Read More.Featured? NECESSITIES ?18 Amazon Purchases Scary Mommy Editors Loved In April 2024If youre a mom in America, chances are you shop on Amazon. So we, the editors of Scary Mommy, have decided to start a new column wherein we highlight our favorite purchases from the past month. Here, then, are Scary Mommy editors favorite, totally random Amazon purchases from April 2024  from a crossbody bag youll use all summer to a great daily sunscreen gel.Read More ?Add To CartAMAZONCompression Packing Cubes for Travel$19.99SHOP NOW ?MAZONTULA Daily SPF 30 Sunscreen Gel$38$31.15SHOP NOW ?AMAZONGrace & Stella Eye Mask$21.95SHOP NOW ?AMAZONBOACAY Soft & Warm Travel Blanket for Airplane & Car$20.99SHOP NOW ?What Were Reading?The Parents Who Think Actually, Television Is the Answer?Jonathan Haidts 'The Anxious Generation' Misses The Point?The 3 Rules Parenting Expert Dr. Becky Has For Her Own Kids Screen TimeFollow us on:Want to Advertise With Us? Get in Touch.You're receiving this email because you signed up to receive communications from BDG Media. If you believe this has been sent to you in error, please safely unsubscribe. Or to manage preferences click hereBDG Media, Inc. · 315 Park Ave. South · New York, NY 10010 · USACopyright 2024 BDG Media, Inc. All rights reserved."	Say Hi To @momcomnyc On Scary Mommy!	spam																																																																																																																																																											
" Fabletics Email Even better? They're only $12. ? ? ? ? ? ? ? ? ? ? ? ? ? ? ? ? ? ? ? ? ? ? ? ? ? ?? ? ? ? ? ? ? ? ? ? ? ? ? ? ? ? ? ? ? ? ? ? ? ?? ? ? ? ? ? ? ? ? ? ? ? ? ? ? ? ? ? ? ? ? ? ? ? ? ? ? ? ? ? ? ? ? ? ? ? ? ? ? ? ? ? ? ? ? ? ? ? ? ? ? ? ? ? ? ? ? ? ? ? ? ? ? ? ? ? ? ? ? ? ? ? ? ? ? ? ? ? ? ? ? ? ? ? ? ? ? ? ? ? ? ? ? ? ? ? ? ? ? ? ? ? ? ? ? ? ? ? ? ? ? ? ? ? ? ? ? ? ? ? ? ? ? ? ? ? ? ? ? ? ? ? ? ? ? ?? ? ? ? ? ? ? ? ? ? ? ? ? ? ? ? ? ? ? ? ? ? ? ? ?? ? ? ? ? ? ? ? ? ? ? ? ? ? ? ? ? ? ? ? ? ? ? ?? ? ? ? ? ? ? ? ? ? ? ? ? ? ? ? ? ? ? ? ? ? ? ? ? ? ? ? ? ? ? ? ? ? ? ? ? ? ? ? ? ? ? ? ? ? ? ? ? ? ? ? ? ? ? ? ? ? ? ? ? ? ? ? ? ? ? ? ? ? ? ? ? ? ? ? ? ? ? ? ? ? ? ? ? ? ? ? ? ? ? ? ? ? ? ? ? ? ? ? ? ? ? ? ? ? ? ? ? ? ? ? ? ? ? ? ? ? ? ? ? ? ? ? ? ? ? ? ? ? ? ? ? ? ? ?? ? ? ? ? ? ? ? ? ? ? ? ? ? ? ? ? ? ? ? ? ? ? ? ?? ? ? ? ? ? ? ? ? ? ? ? ? ? ? ? ? ? ? ? ? ? ? ?? ? ? ? ? ? ? ? ? ? ? ? ? ? ? ? ? ? ? ? ? ? ? ? ? ? ? ? ? ? ? ? ? ? ? ? ? ? ? ? ? ? ? ? ? ? ? ? ? ? ? ? ? ? ? ? ? ? ? ? ? ? ? ? ? ? ? ? ? ? ? ? ? ? ? ? ? ? ? ? ? ? ? ? ? ? ? ? ? ? ? ? ? ? ? ? ? ? ? ? ? ? ? ? ? ? ? ? ? ? ? ? ? ? ? ? ? ? ? ? ? ? ? ? ? ? ? ? ? ? ? ? ? ? ? ?? ? ? ? ? ? ? ? ? ? ? ? ? ? ? ? ? ? ? ? ? ? ? ? ?? ? ? ? ? ? ? ? ? ? ? ? ? ? ? ? ? ? ? ? ? ? ? ?? ? ? ? ? ? ? ? ? ? ? ? ? ? ? ? ? ? ? ? ? ? ? ? ? ? ? ? ? ? ? ? ? ? ? ? ? ? ? ? ? ? ? ? ? ? ? ? ? ? ? ? ? ? ? ? ? ? ? ? ? ? ? ? ? ? ? ? ? ? ? ? ? ? ? ? ? ? ? ? ? ? ? ? ? ? ? ? ? ? ? ? ? ? ? ? ? ? ? ? ? ? ? ? ? ? ? ? ? ? ? ? ? ? ? ? ? ? ? ? ? ? ? ? ? ? ? ?? ? ? ? ? ? ? ? Upon enrollment in the VIP Membership Program, simply skip by the 5th of every month if you do not want a $59.95 Member Credit charged to your payment method. Member Credits can be redeemed for any item or 2 piece outfit up to $100 and expire after 12 months. See additional new VIP promo terms below. WOMENS MENS SCRUBS SHAPEWEAR VISIT ONE OF OUR STORES SEE ALL STORES WOMENS MENS SCRUBS SHAPEWEAR VISIT ONE OF OUR STORES SEE ALL STORES Fabletics | 555 Aviation Blvd., El Segundo, CA 90245 You are receiving this email because you signed up for personalized matches from fabletics.com. *REACTIVATING VIP OFFER: 2/$24 women's leggings and shorts, up to 80% off all women's items, 70% off all men's items (online only, excluding Onesies, Swim, Scrubs and YITTY), $19 Onesie, $24 Swim, $19 Scrub Set, $24 Scrub Jumpsuit and 50% off scrubs offering is valid on select Fabletics products on the first order you place as a new VIP member and is subject to availability at Fabletics.com. $12 women's leggings and shorts when you buy 2 and YITTY offers cannot be combined. $19 Onesie is limited to 1 onesie. $24 Swim offer is limited to 1 one-piece and 1 bundle. $19 Scrub Set offer is limited to 1 set (Scrubs Jackets excluded). $24 Jumpsuit offer is limited to 1 jumpsuit. You must opt-in to the Fabletics VIP membership program in order to redeem offer. Offer is valid from 4/23/24 at 11:00AM PT through 5/22/24 at 3:00PM PT. Offer cannot be applied to previous purchases or the purchase of gift cards and cannot be redeemed for cash. Offer cannot be combined with any other offer, promotion or discount. Discount is automatically applied at checkout. No promo code necessary. Offer valid for one time use only and is applied at checkout. Returns and Exchanges are allowed for this offer. Standard shipping rates apply. Terms and dates of offer are subject to change at any time without notice. Upon enrollment in the VIP Membership Program, if you do not skip the month between the 1st and 5th of the month, your credit card or payment method will be charged $59.95 USD for your membership benefits on the 6th until you cancel. Membership benefits include access to exclusive products and a promotional Member Credit which unlocks our best prices. Member Credits can be redeemed for any item, outfit, or bundle up to $100 (online or in store), and can be used at both Fabletics and YITTY. You may cancel at any time online or by calling 1-844-322-5384. Member Credits expire 12 months from charge. Dont worrywell remind you! View on Web Browser. *Our full shipping and return policy can be found here. This notice is an advertisement from Fabletics.com about a better way to shop for athleticwear for the workout and beyond. Ensure you receive future messages by adding fabletics@e-mail.fabletics.com to your address book. For additional assistance, contact us. Unsubscribe | Privacy Policy | Terms of Service "	Your May Leggings are HERE!	spam																																																																																																																																																											
"It's Gonna Be May!?? A 1-Point Moment Drops SoonDance with Lance Bass of *NSYNC  for just 1 point. » MY ACCOUNT » find & reserve Score an Exclusive 1-Point MomentJoin Lance Bass of *NSYNC for the Ultimate Dance ClassDance like no one is watching at this once-in-a-lifetime class with Lance Bass of *NSYNC and TikTok sensation Cost n Mayor in Los Angeles. Be sure to have at least 1 point in your account and set a reminder for the drop!A total of 15 packages will be available for 1 point each on May 2, 2024, at noon ET/11 a.m. CT.Miss the drop? Dont worry  an additional five packages will be available for auction.View Moment Superhero Fans, Assemble!Tour the movie studio where some of the biggest blockbuster films are made and stay at the new Trilith Guesthouse, Fayetteville, Georgia, a Tribute Portfolio Hotel.» View Moment Dont Miss OutThese Moments Could Be YoursExplore Andalusia With Chef José Pizarro» Taste And TourTaylorMade Custom Fitting» Swing Like The ProsConcerts at Scotiabank Arena» Rock Out In TorontoCatch U.S. National Soccer Games» Score Great SeatsCelebrate Pride with LoveTravels» Join Us Make your move to our 1-Point Drop with Lance Bass of *NSYNC.Follow Us UNSUBSCRIBETERMS OF USEPREFERENCESPRIVACY CENTERWeb View ©2024 Marriott International, Inc. For California residents: California Statement of Financial Incentive To unsubscribe from marketing emails, click here. If you unsubscribe from Marriott promotional emails like this, we will continue to send only transactional messages such as reservation confirmation emails. You can also unsubscribe by writing to: Marriott Bonvoy910 West Legacy Center Way, Suite 100, Midvale, UT 84047 USA "	It's Gonna Be May!?? A 1-Point Moment Drops Soon	spam																																																																																																																																																											
"Mother's Day is around the corner 21880 HAWTHORNE BLVDTORRANCE CA *Styles, selections, availability and prices may vary by store. Products shown are intended to be representative of a specific category and may or may not be available at your local Burlington store. Advertised prices are subject to state and local taxes and fees. Up to comparable value savings percentages are based on initial assortment offerings; supplies are limited and our inventory is always changing. Shop early in stores for the best values and selections. Comparable value is determined by our buyers, who estimate retail prices of the same or similar products sold at full price retailers. Visit Burlington.com to view our complete Pricing Policy 1Offer is exclusive to Burlington Credit Card holders enrolled in the Burlington Credit Card Rewards program. This rewards program is provided by Burlington and its terms may change at any time. For full Rewards Terms and Conditions, please see Burlington.com/mycard. Credit card offers are subject to credit approval. Burlington Credit Card Accounts are issued by Comenity Capital Bank.This email is for marketing purposes. This email was sent to erinsalik@gmail.com on behalf of Burlington. To update your preferences, click here.To unsubscribe, click here. © 2024 Burlington Stores, Inc. | 2006 Route 130 North, Burlington, NJ 08016 "	UNDER $15: Give mom a gift she'll LOVE!	spam																																																																																																																																																											
