text	subject	label																																																																																																																																																											
"Plus, Up to 70% OFF SITEWIDE w/EXTRA 25% OFF (use code SAVEBIG)? ? ? ? ? ? ? ? ? ? ? ? ? ? ? ? ? ? ? ? ? ? ? ? ? ? ? ? ? ? ? ? ? ? ? ? ? ? ? ? ? ? ? ? ? ? ? ? ? ? ? ? ? ? ? ? ? ? ? ? ? ? ? ? ? ? ? ? ? ? ? ? ? ? ? ? ? ? ? ? ? ? ? ? ? ? ? ? ? ? ? ? ? ? ? ? ? ? ? ? ? ? ? ? ? ? ? ? ? ? ? ? ? ? ? ? ? ? ? ? ? ? ? ? ? ? ? ? ? ? ? ? ? ? ? ? ? ? ? ? ? ? ? ? ? ? ? ? ? ? ? ? ? ? ? ? ? ? ? ? ? ? ? ? ? ? ? ? ? ? ? ? ? ? ? ? ? ? ? ? ? ? ? ? ? ? ? ? ? ? ? ? ? ? ? ? ? ? ? ? HI ERIN, YOUR MY PLACE REWARDS POINT BALANCE: -100 LOG INSHOP NOWGIRLBOYTODDLER GIRLTODDLER BOYGIRLBOYTODDLER GIRLTODDLER BOYTWEENBABYGIRLBOYTODDLER GIRLTODDLER BOYTWEENGIRLBOYTODDLER GIRLTODDLER BOYGIRLTODDLER GIRLTWEENMOM & ME STYLESGIRLBOYTODDLER GIRLTODDLER BOYTWEENSHOP NOWGIRLBOYTODDLER GIRLTODDLER BOYTWEENGIRLBOYTODDLER GIRLTODDLER BOYTWEENGIRLBOYTODDLER GIRLTODDLER BOYSHOP TWEENGIRLBOYTODDLER GIRLTODDLER BOYTWEENBABYWOMENMENGIRLBOYTODDLER GIRLTODDLER BOYTWEENBABYADULT Gift Cards | My Account | Customer Service | Privacy | StoresGirlToddler GirlBoyToddler BoyBabyClearanceGift Cards | My Account | Customer ServicePrivacy | StoresCONNECT WITH US*See offer exclusions and details below. Some restrictions apply. GENERAL OFFER TERMS & CONDITIONS Select styles. Merchandise selection, prices and promotions may vary online and by store location. Cannot be combined with any other offer. FREE STANDARD SHIPPING FOR ORDERS TOTALING $20 OR MOREFree Standard Shipping will automatically be applied to all eligible merchandise orders totaling $20 or more shipping to one address only. Eligible purchase amount is the transaction total for merchandise and gift-wrap products after any coupons or other discounts, and does NOT include taxes, shipping costs or purchases of gift cards. Valid only on merchandise orders placed online at childrensplace.com and gymboree.com and on The Childrens Place, Inc. official mobile apps. Valid only on qualifying orders shipped to a street address in the contiguous U.S. or U.S. Territories, a PO Box address in the contiguous U.S. or a U.S. PO Box (but not a street address) in the following areas: APO/FPO, AK, HI and some rural areas. Not valid on any Express or Rush Shipping service. Not valid on previously purchased merchandise. These terms and conditions may be cancelled or modified by The Childrens Place, Inc. at any time. EXTRA 25% OFF $75 or 20% OFF YOUR ORDER with code SAVEBIGValid April 30 - May 3, 2024. Valid on select styles marked as eligible only. Excludes clearance and graphic tee styles. Valid online at childrensplace.com, gymboree.com, and on The Childrens Place, Inc. official mobile apps only. Valid on qualifying orders shipped within the U.S. and Puerto Rico only. Not valid in stores. Valid on The Childrens Place, Gymboree, Sugar & Jade and PJ Place branded merchandise only. Take 20% off when you spend $1-$74.99 or take 25% off when you spend $75.99 or more when you present or enter the code at checkout. Each transaction must total the specified amount or more, and for each purchase the eligible purchase amount is the transaction total for merchandise and gift wrap products after any coupons or other discounts are applied, and minus any returns, refunds or credit adjustments, and does NOT include taxes, shipping, or purchases of gift cards. Dollar off coupons will be applied as a percentage discount on each eligible item in your transaction but will appear as a dollar amount applied. Valid toward multiple purchases. Limit one coupon per transaction. Not valid toward purchase of gift cards, previously purchased merchandise, credit card payments or licensed or third-party branded products. Cannot be redeemed in a closing store, in conjunction with any in-store or online site-wide percentage-off event or on bulk purchases. Coupons are not redeemable for cash or merchandise credit and have no cash value. Returns and exchanges are subject to discount taken at time of redemption. May not be purchased, duplicated, traded or sold. Only original coupons will be accepted. Valid coupon code must be provided at checkout. Offer will not be re-issued if lost, stolen, corrupted or destroyed or with return/refund of merchandise. Internet distribution strictly prohibited. Not valid in conjunction with The Childrens Place associate discount. Cannot be combined with any offer except My Place Rewards certificates. Use of coupon is acceptance of its terms. Offer may be cancelled or modified by The Childrens Place, Inc. at any time. Void where prohibited. BUY (1) GRAPHIC TEE, GET (1) GRAPHIC TEE AT 50% OFFValid April 30 - May 3, 2024 only on specially-marked The Childrens Place, Sugar & Jade and PJ Place branded graphic tees when purchased at childrensplace.com or on The Childrens Place official mobile app. and shipped within the U.S. and Puerto Rico only. Offer valid on in-stock merchandise only. Excludes Gymboree graphic tee styles. Buy one (1) graphic tee, get one (1) graphic tee of equal or lesser value at 50% off. Discount will be shown in cart after qualifying items have been added. Discount calculated using the lower priced item before tax and shipping. If the qualifying item is returned, refund value will be reduced by the prorated amount of the discounted item. Not valid in conjunction with The Childrens Place associate discount. Cannot be combined with any offer or discount except My Place Rewards certificates. Participation in offer is acceptance of its terms. Offer may be cancelled or modified by The Childrens Place, Inc. at any time. Void where prohibited. MY PLACE REWARDS MEMBER EVERYDAY POINTS & REWARDS OFFER Offer only available at U.S. and Puerto Rico stores, online at childrensplace.com, gymboree.com, sugarandjade.com and pjplace.com, and on The Childrens Place, Inc. official mobile apps. Valid on qualifying orders shipped within the U.S. and Puerto Rico only. Valid on The Childrens Place, Gymboree, Sugar & Jade and PJ Place branded merchandise only. Mentioned earning based on My Place Rewards Members earn 1 point per U.S. $1 spent, rounded to the nearest dollar for eligible purchases. Points for each qualified in-store purchase will reflect in the member's account within 48 hours. Points for each qualified online purchase will reflect in the member's account after receiving Ship Confirmation email. My Place Rewards Members receive a $5 Rewards Certificate for every 100 points. Points have no cash value. Must have valid email address and U.S. mailing address. Offer is available to all My Place Rewards Members. Eligible purchase amount is the transaction total for merchandise and gift wrap products after any coupons or other discounts are applied, and minus any returns, refunds or credit adjustments, and does NOT include taxes, shipping, or purchases of gift cards. This rewards program is provided by The Children's Place, Inc. and its terms may change at any time. For full Rewards Terms and Conditions, please see childrensplace.com/rewards-terms. MY PLACE REWARDS CREDIT CARDHOLDER EVERYDAY POINTS & REWARDS OFFER Offer only available at U.S. and Puerto Rico stores, online at childrensplace.com, gymboree.com, sugarandjade.com and pjplace.com, and on The Childrens Place, Inc. official mobile apps. Valid on qualifying orders shipped within the U.S. and Puerto Rico only. Valid on The Childrens Place, Gymboree, Sugar & Jade and PJ Place branded merchandise only. Mentioned earning based on My Place Rewards Credit Cardholders earn 2 points per U.S. $1 spent with the My Place Rewards Credit Card, rounded to the nearest dollar for eligible purchases. Double points for each qualified in-store purchase will reflect in the members account within 48 hours. Double points for each qualified online purchase will reflect in the members account after receiving Ship Confirmation email. My Place Rewards Members receive a $5 Rewards Certificate for every 100 points. Points have no cash value. Must have valid email address and U.S. mailing address. Offer is exclusive to My Place Rewards Credit Card holders enrolled in the My Place Rewards program. Eligible purchase amount is the transaction total for merchandise and gift wrap products after any coupons or other discounts are applied, and minus any returns, refunds or credit adjustments, and does NOT include taxes, shipping, or purchases of gift cards. This rewards program is provided by The Children's Place, Inc. and its terms may change at any time. For full Rewards Terms and Conditions, please see childrensplace.com/rewards-terms. MY PLACE REWARDS CREDIT CARDHOLDER 30% OFF FIRST PURCHASE OFFER Offer only available at U.S. and Puerto Rico stores, online at childrensplace.com, gymboree.com, sugarandjade.com and pjplace.com, and on The Childrens Place, Inc. official mobile apps. Subject to credit approval. Valid on qualifying orders shipped within the U.S. and Puerto Rico only. Valid on The Childrens Place, Gymboree, Sugar & Jade and PJ Place branded merchandise only. Offer cannot be combined with other offers except My Place Rewards certificates. Valid one time only. The entire transaction amount after discount must be placed on the My Place Rewards Credit Card. Eligible purchase amount is the transaction total for merchandise and gift wrap products after any coupons or other discounts are applied, and minus any returns, refunds or credit adjustments, and does NOT include taxes, shipping, or purchases of gift cards. Not valid toward purchase of gift cards, previously purchased merchandise, or licensed or third-party branded products. Cannot be redeemed in a closing store, in conjunction with any in-store or online site-wide percentage-off event or on bulk purchases. Offer has no cash value. Returns and exchanges are subject to discount taken at time of redemption. May not be purchased, duplicated, traded or sold. Only original coupons will be accepted. Offer will not be re-issued if lost, stolen or destroyed or with return/refund of merchandise. Internet distribution strictly prohibited. Not valid in conjunction with The Childrens Place associate discount. Coupon terms and conditions apply. Use of coupon is acceptance of its terms. Offer may be cancelled or modified by The Childrens Place, Inc. at any time. Void where prohibited. Offer is exclusive to My Place Rewards Credit Card holders enrolled in the My Place Rewards program. This rewards program is provided by The Children's Place, Inc. and its terms may change at any time. For full Rewards Terms and Conditions, please see childrensplace.com/rewards-terms. Credit card offers are subject to credit approval.My Place Rewards Credit Card Accounts are issued by Comenity Capital Bank. MY PLACE REWARDS MEMBER 2X BONUS POINTS EVENT Offer only available at U.S. and Puerto Rico stores and at childrensplace.com when shipping within the U.S. and Puerto Rico only. Valid on mix & match, shorts and graphic tees marked as eligible only. To receive Double Points, a My Place Rewards Member must make a qualifying My Place Rewards purchase during the Bonus Points Event in U.S. or Puerto Rico stores or at childrensplace.com when shipping within the U.S. or Puerto Rico only. My Place Rewards Members will earn 2 points for every U.S. $1 spent. Double points for each qualified in-store purchase will reflect in the members account within 48 hours. Double points for each qualified online purchase will reflect in the members account after receiving Ship Confirmation email. Points have no cash value. Must have valid email address and U.S. mailing address. Eligible purchase amount is the transaction total for merchandise and gift wrap products after any coupons or other discounts are applied, and minus any returns, refunds or credit adjustments, and does NOT include taxes, shipping, or purchases of gift cards. Cannot be combined with other purchase-based point offers, whether qualifying purchase is made in-store, online or within the app(s). Valid on The Childrens Place branded merchandise only; excludes sleepwear, Gymboree, Sugar & Jade and PJ Place branded merchandise. Excludes purchases of gift cards and purchases on The Children's Place, Inc. official mobile apps. This rewards program is provided by The Children's Place, Inc. and its terms may change at any time. For full Rewards Terms and Conditions, please visit childrensplace.com/rewards-terms. Valid 4/10/24 through 11:59 pm Central Time on 5/7/24. MY PLACE REWARDS CREDIT CARDHOLDER 3X BONUS POINTS EVENT Offer only available at U.S. and Puerto Rico stores and at childrensplace.com when shipping within the U.S. and Puerto Rico only. Valid on mix & match, shorts and graphic tees marked as eligible only. To receive Triple Points, a My Place Rewards Member must make a qualifying My Place Rewards purchase during the Bonus Points Event in U.S. or Puerto Rico stores or at childrensplace.com when shipping within the U.S. or Puerto Rico only. Cardholders will earn 3 My Place Rewards Member points per U.S. $1 spent with the My Place Rewards Credit Card. The entire transaction amount must be placed on the My Place Rewards Credit Card. Triple points for each qualified in-store purchase will reflect in the members account within 48 hours. Triple points for each qualified online purchase will reflect in the members account after receiving Ship Confirmation email. Points have no cash value. Must have valid email address and U.S. mailing address. Eligible purchase amount is the transaction total for merchandise and gift wrap products after any coupons or other discounts are applied, and minus any returns, refunds or credit adjustments, and does NOT include taxes, shipping, or purchases of gift cards. Offer is exclusive to My Place Rewards Credit Cardholders enrolled in the My Place Rewards program. Cannot be combined with other purchase-based point offers, whether qualifying purchase is made in-store, online or within the app(s). Valid on The Childrens Place branded merchandise only; excludes sleepwear, Gymboree, Sugar & Jade and PJ Place branded merchandise. Excludes purchases of gift cards and purchases on The Children's Place, Inc. official mobile apps. This rewards program is provided by The Children's Place, Inc. and its terms may change at any time. For full Rewards Terms and Conditions, please see childrensplace.com/rewards-terms. Valid 4/10/24 through 11:59 pm Central Time on 5/7/24. Credit card offers are subject to credit approval. My Place Rewards Credit Card Accounts are issued by Comenity Capital Bank. AFTERPAY DETAILS Late fees may apply. Eligibility criteria apply. See here for more details. Loans to California residents made or arranged pursuant to a California Finance Lenders Law license. © 2021 Afterpay US GIVE BACK BOX x MY PLACE REWARDS BONUS POINTS OFFER Offer is available to My Place Rewards members. To receive bonus points, a customer must complete a Give Back Box donation following the steps set forth at childrensplace.com/us/content/give-back-box. Must have valid email address and U.S. mailing address. Bonus points may take up to 14 business days to add to your account after the donation is received. All bonus points will be awarded to the My Place Rewards Account that is associated with the shipping label created in connection with the Give Back Box donation. Bonus points have no cash value. Earn 100 points per donation for donations completed. While there is no limit on how many Give Back Box donations a customer can make, a customer can only earn points one (1) time per calendar week for a Give Back Box donation. Give Back Box donations in excess of this stated limitation will not be eligible to receive points. Cannot be combined with other Give Back Box point offers. Rewards program is provided by The Childrens Place, Inc. and its terms may change at any time. The Childrens Place, Inc. reserves the right to cancel your participation in My Place Rewards, in the event of fraud, abuse of rewards privileges, or violation of the Terms & Conditions. All applicable Rewards Terms and Conditions, available at childrensplace.com/us/content/myplace-rewards-terms. Valid now through 11:59 pm Central Time on the date included in banner above. BUY ONLINE SHIP TO STORE 20% OFF OFFER The discount will automatically be applied at checkout when Ship to Store is selected. Eligible items may vary. Available for shipments to select U.S stores only; not available for shipments to stores in Hawaii, Puerto Rico or Canada. Not valid in conjunction with The Childrens Place associate discount. Item availability not guaranteed. Offer is subject to change and/or termination without notice. Not valid for cash. Void where prohibited. MY PLACE REWARDS MEMBER POINTS BALANCE Total may not reflect all transactions in the last 48 hours. Please take a moment to add thechildrensplace@promo.childrensplace.com to your address book. This email was sent to erinsalik@gmail.com because you requested to receive marketing messages from The Children's Place. This email may be considered an advertising or promotional message. You can withdraw your consent at any time. To update your email preferences or to unsubscribe, click here. UPDATE EMAIL PREFERENCES | UNSUBSCRIBE | PRIVACY POLICY | CONTACT US© 2024 The Children's Place, Inc. All rights reserved.The Children's Place, Inc., 500 Plaza Drive, Secaucus, NJ 07094, USFor customer service, please visit our contact us page or call us at 1-877-752-2387."	"SITEBUSTER! Graphic Tees: BUY ONE, GET ONE 50% OFF ??"	spam																																																																																																																																																											
" Last chance for Mothers Day delivery ? ? ? ? ? ? ? ? ? ? ? ? ? ? ? ? ? ? ? ? ? ? ? ? ? ? ? ? ? ? ? ? ? ? ? ? ? ? ? ? ? ? ? ? ? ? ? ? ? ? ? ? ? ? ? ? ? ? ? ? ? ? ? ? ? ? ? ? ? ? ? ? ? ? ? ? ? ? ? ? ? ? ? ? ? ? ? ? ? ? ? ? ? ? ? ? ? ? ? ? ? ? ? ? ? ? ? ? ? ? ? ? ? ? ? ? ? ? ? ? ? ? ? ? ? ? ? ? ? ? ? ? ? ? ? ? ? ? ? ? ? ? ? ? ? ? ? ? ? ? ­ ­ ­ ­ ­ ­ ­ ­ ­ ­ ­ ­ ­ ­ ­ ­ ­ ­ ­ ­ ­ ­ ­ ­ ­ ­ ­ ­ ­ ­ ­ ­ ­ ­ ­ ­ ­ ­ ­ ­ ­ ­ ­ ­ ­ ­ ­ ­ ­ ­ ­ ­ ­ ­ ­ ­ ­ ­ ­ ­ ­ ­ ­ ­ ­ ­ ­ ­ ­ ­ ­ ­ ­ ­ ­ ­ ­ ­ ­ ­ ­ ­ ­ ­ ­ ­ ­ ­ ­ ­ ­ ­ ­ ­ ­ ­ ­ ­ ­ ­ ­ ­ ­ ­ ­ ­ ­ ­ ­ ­ ­ ­ ­ ­ ­ ­ ­ ­ ­ ­ ­ ­ ­ ­ ­ ­ ­ ­ ­ ­ ­ ­ ­ ­ ­ ­ ­ ­ ­ ­ ­ ­ ­ ­ ­ ­ ­ ­ ­ ­ *Delivery dates are not guaranteed due to potential shipping carrier delays. Please refer to your order tracking number for the most up-to-date delivery information.©2024 OSEA International, LLC. All rights reserved. 1795 Washington Way Venice, CA 90291 Unsubscribe "	What Our Founders Are Gifting	spam																																																																																																																																																											
" Hi Boaz, Your package has been delivered! How was your delivery? It was great Not so great Order # 113-7612059-5377823 Track your package Return or replace items in Your Orders. This email was sent from a notification-only email address that cannot accept incoming email. Please do not reply to this message.  2019 Amazon.com, Inc. or its affiliates. All rights reserved. Amazon, Amazon.com, and the Amazon.com logo are registered trademarks of Amazon.com, Inc. or its affiliates. Amazon.com, 410 Terry Avenue N., Seattle, WA 98109-5210 "	Delivered: Your Amazon.com order #113-7612059-5377823																																																																																																																																																												
" Prose with our Warehouse Team INSTAGRAM FACEBOOK TIKTOK YOUTUBE CONTACT | PRIVACY | TERMS | UNSUBSCRIBE PROSE NYC / 10 GRAND STREET / BROOKLYN, NY 11249 PROSE - 2024 ALL RIGHTS RESERVED *Get 15% and an additional 35% off your first subscription order for a total discount of 50% off. Free shipping and 15% off will be applied to all following haircare or skincare subscription orders. Subscribe to both haircare and skincare to receive an additional 5% discount, for a total discount of 20%. All products except accessories are eligible for subscription. Accessories include hair towels, candles, and brushes. Gift cards are also ineligible for subscription. "	Pushing sustainability forward																																																																																																																																																												
"HDFC BANKDear Customer, Rs.165.00 has been debited from account **8865 to VPA paytmqr135xjfvji1@paytm on 01-05-24. Your UPI transaction reference number is 412202854275. Please call on 18002586161 to report if this transaction was not authorized by you. Warm Regards, HDFC BankFor more details on Service charges and Fees, click here. HDFC Bank "	?  You have done a UPI txn. Check details!																																																																																																																																																												
"iTunes Connect My Brands  Alpha 1.1.0 (40) is ready to test on iOS. What to Test:Frontend Bug Fixes: fixed: posting screen does not allow changing item url fixed: keyboard covers up the share vendor page, not able to share vendorreduced the spacing between the person who posted and the imagereduced the spacing between first comment and like/comment iconschanged language and icon of email connections that are only meant for ""forwarding emails"" fixed: notification images are inconsistent / load slowly / don't show up at all at timesdelete transaction UI - add trash icon to purchase detail pagefixed: delete is not working + submit button is black changed deletion reason languagechanged: On profile page change the tab name from ""Feed"" to ""My Posts"" fixed: User profile page should refresh the page after follow button is clickedchanged language for the error on adding a vendor post to a list made the image detail scrollable when you zoom in More coming tomorrow!To test this app, open TestFlight on iPhone or iPod touch using iOS 12.0 or later and install the update.By using My Brands  Alpha, you agree that crash data as well as statistics about how you use My Brands  Alpha will be provided to Boaz Salik and linked to your email address. Boaz Salik may contact you regarding this information. Review the TestFlight Terms and Conditions, as well as the terms, policies, and practices of Boaz Salik. Beta versions of apps may crash or result in data loss. TestFlight is a service provided by Apple.Terms of Service | Privacy Policy | Unsubscribe Copyright  2024 Apple Inc. One Apple Park Way Cupertino, CA 95014, United States. "	My Brands  Alpha 1.1.0 (40) for iOS is now available to test.																																																																																																																																																												
"It's Gonna Be May!?? A 1-Point Moment Drops SoonDance with Lance Bass of *NSYNC  for just 1 point.  MY ACCOUNT  find & reserve Score an Exclusive 1-Point MomentJoin Lance Bass of *NSYNC for the Ultimate Dance ClassDance like no one is watching at this once-in-a-lifetime class with Lance Bass of *NSYNC and TikTok sensation Cost n Mayor in Los Angeles. Be sure to have at least 1 point in your account and set a reminder for the drop!A total of 15 packages will be available for 1 point each on May 2, 2024, at noon ET/11 a.m. CT.Miss the drop? Dont worry  an additional five packages will be available for auction.View Moment Superhero Fans, Assemble!Tour the movie studio where some of the biggest blockbuster films are made and stay at the new Trilith Guesthouse, Fayetteville, Georgia, a Tribute Portfolio Hotel. View Moment Dont Miss OutThese Moments Could Be YoursExplore Andalusia With Chef Jos Pizarro Taste And TourTaylorMade Custom Fitting Swing Like The ProsConcerts at Scotiabank Arena Rock Out In TorontoCatch U.S. National Soccer Games Score Great SeatsCelebrate Pride with LoveTravels Join Us Make your move to our 1-Point Drop with Lance Bass of *NSYNC.Follow Us UNSUBSCRIBETERMS OF USEPREFERENCESPRIVACY CENTERWeb View 2024 Marriott International, Inc. For California residents: California Statement of Financial Incentive To unsubscribe from marketing emails, click here. If you unsubscribe from Marriott promotional emails like this, we will continue to send only transactional messages such as reservation confirmation emails. You can also unsubscribe by writing to: Marriott Bonvoy910 West Legacy Center Way, Suite 100, Midvale, UT 84047 USA "	It's Gonna Be May!?? A 1-Point Moment Drops Soon																																																																																																																																																												
" That's right! This video was made just for you. Hi Anthony, Thank you very much for supporting REP Provisions I recorded a short video just for you, hope you enjoy! ""Anthony, thank you for your purchase of..."" Watch video! Cheers, Eric  2023 REP Provisions. All rights reserved. Unsubscribe"	"A video just for you from our co-founder, Eric!"																																																																																																																																																												
