text	subject	label																																																																																																																																																											
"Plus, STOREWIDE SAVINGS up to 70% OFF!? ? ? ? ? ? ? ? ? ? ? ? ? ? ? ? ? ? ? ? ? ? ? ? ? ? ? ? ? ? ? ? ? ? ? ? ? ? ? ? ? ? ? ? ? ? ? ? ? ? ? ? ? ? ? ? ? ? ? ? ? ? ? ? ? ? ? ? ? ? ? ? ? ? ? ? ? ? ? ? ? ? ? ? ? ? ? ? ? ? ? ? ? ? ? ? ? ? ? ? ? ? ? ? ? ? ? ? ? ? ? ? ? ? ? ? ? ? ? ? ? ? ? ? ? ? ? ? ? ? ? ? ? ? ? ? ? ? ? ? ? ? ? ? ? ? ? ? ? ? ? ? ? ? ? ? ? ? ? ? ? ? ? ? ? ? ? ? ? ? ? ? ? ? ? ? ? ? ? ? ? ? ? ? ? ? ? ? ? ? ? ? ? ? ? ? ? ? ? ? HI ERIN, YOUR MY PLACE REWARDS POINT BALANCE: -100 LOG INGIRLBOYTODDLER GIRLTODDLER BOYMATCHING FAMILYLOCATE A STOREGIRLBOYTODDLER GIRLTODDLER BOYGIRLBOYTODDLER GIRLTODDLER BOYGIRLTODDLER GIRLMOM & ME STYLESGIRLBOYTODDLER GIRLTODDLER BOYGIRLBOYTODDLER GIRLTODDLER BOYGIRLBOYTODDLER GIRLTODDLER BOYGIRLBOYTODDLER GIRLTODDLER BOYGIRLBOYTODDLER GIRLTODDLER BOYBABYGIRLBOYTODDLER GIRLTODDLER BOYBABYADULT Gift Cards | My Account | Customer Service | Privacy | StoresGirlToddler GirlBoyToddler BoyBabyClearanceGift Cards | My Account | Customer ServicePrivacy | StoresCONNECT WITH US*See offer exclusions and details below. Some restrictions apply. GENERAL OFFER TERMS & CONDITIONS Select styles. Merchandise selection, prices and promotions may vary online and by store location. Cannot be combined with any other offer. FREE STANDARD SHIPPING FOR ORDERS TOTALING $20 OR MOREFree Standard Shipping will automatically be applied to all eligible merchandise orders totaling $20 or more shipping to one address only. Eligible purchase amount is the transaction total for merchandise and gift-wrap products after any coupons or other discounts, and does NOT include taxes, shipping costs or purchases of gift cards. Valid only on merchandise orders placed online at childrensplace.com and gymboree.com and on The Childrens Place, Inc. official mobile apps. Valid only on qualifying orders shipped to a street address in the contiguous U.S. or U.S. Territories, a PO Box address in the contiguous U.S. or a U.S. PO Box (but not a street address) in the following areas: APO/FPO, AK, HI and some rural areas. Not valid on any Express or Rush Shipping service. Not valid on previously purchased merchandise. These terms and conditions may be cancelled or modified by The Childrens Place, Inc. at any time. MY PLACE REWARDS MEMBER EVERYDAY POINTS & REWARDS OFFER Offer only available at U.S. and Puerto Rico stores, online at childrensplace.com, gymboree.com, sugarandjade.com and pjplace.com, and on The Childrens Place, Inc. official mobile apps. Valid on qualifying orders shipped within the U.S. and Puerto Rico only. Valid on The Childrens Place, Gymboree, Sugar & Jade and PJ Place branded merchandise only. Mentioned earning based on My Place Rewards Members earn 1 point per U.S. $1 spent, rounded to the nearest dollar for eligible purchases. Points for each qualified in-store purchase will reflect in the member's account within 48 hours. Points for each qualified online purchase will reflect in the member's account after receiving Ship Confirmation email. My Place Rewards Members receive a $5 Rewards Certificate for every 100 points. Points have no cash value. Must have valid email address and U.S. mailing address. Offer is available to all My Place Rewards Members. Eligible purchase amount is the transaction total for merchandise and gift wrap products after any coupons or other discounts are applied, and minus any returns, refunds or credit adjustments, and does NOT include taxes, shipping, or purchases of gift cards. This rewards program is provided by The Children's Place, Inc. and its terms may change at any time. For full Rewards Terms and Conditions, please see childrensplace.com/rewards-terms. MY PLACE REWARDS CREDIT CARDHOLDER EVERYDAY POINTS & REWARDS OFFER Offer only available at U.S. and Puerto Rico stores, online at childrensplace.com, gymboree.com, sugarandjade.com and pjplace.com, and on The Childrens Place, Inc. official mobile apps. Valid on qualifying orders shipped within the U.S. and Puerto Rico only. Valid on The Childrens Place, Gymboree, Sugar & Jade and PJ Place branded merchandise only. Mentioned earning based on My Place Rewards Credit Cardholders earn 2 points per U.S. $1 spent with the My Place Rewards Credit Card, rounded to the nearest dollar for eligible purchases. Double points for each qualified in-store purchase will reflect in the members account within 48 hours. Double points for each qualified online purchase will reflect in the members account after receiving Ship Confirmation email. My Place Rewards Members receive a $5 Rewards Certificate for every 100 points. Points have no cash value. Must have valid email address and U.S. mailing address. Offer is exclusive to My Place Rewards Credit Card holders enrolled in the My Place Rewards program. Eligible purchase amount is the transaction total for merchandise and gift wrap products after any coupons or other discounts are applied, and minus any returns, refunds or credit adjustments, and does NOT include taxes, shipping, or purchases of gift cards. This rewards program is provided by The Children's Place, Inc. and its terms may change at any time. For full Rewards Terms and Conditions, please see childrensplace.com/rewards-terms. MY PLACE REWARDS CREDIT CARDHOLDER 30% OFF FIRST PURCHASE OFFER Offer only available at U.S. and Puerto Rico stores, online at childrensplace.com, gymboree.com, sugarandjade.com and pjplace.com, and on The Childrens Place, Inc. official mobile apps. Subject to credit approval. Valid on qualifying orders shipped within the U.S. and Puerto Rico only. Valid on The Childrens Place, Gymboree, Sugar & Jade and PJ Place branded merchandise only. Offer cannot be combined with other offers except My Place Rewards certificates. Valid one time only. The entire transaction amount after discount must be placed on the My Place Rewards Credit Card. Eligible purchase amount is the transaction total for merchandise and gift wrap products after any coupons or other discounts are applied, and minus any returns, refunds or credit adjustments, and does NOT include taxes, shipping, or purchases of gift cards. Not valid toward purchase of gift cards, previously purchased merchandise, or licensed or third-party branded products. Cannot be redeemed in a closing store, in conjunction with any in-store or online site-wide percentage-off event or on bulk purchases. Offer has no cash value. Returns and exchanges are subject to discount taken at time of redemption. May not be purchased, duplicated, traded or sold. Only original coupons will be accepted. Offer will not be re-issued if lost, stolen or destroyed or with return/refund of merchandise. Internet distribution strictly prohibited. Not valid in conjunction with The Childrens Place associate discount. Coupon terms and conditions apply. Use of coupon is acceptance of its terms. Offer may be cancelled or modified by The Childrens Place, Inc. at any time. Void where prohibited. Offer is exclusive to My Place Rewards Credit Card holders enrolled in the My Place Rewards program. This rewards program is provided by The Children's Place, Inc. and its terms may change at any time. For full Rewards Terms and Conditions, please see childrensplace.com/rewards-terms. Credit card offers are subject to credit approval.My Place Rewards Credit Card Accounts are issued by Comenity Capital Bank. MY PLACE REWARDS MEMBER 2X BONUS POINTS EVENT Offer only available at U.S. and Puerto Rico stores and at childrensplace.com when shipping within the U.S. and Puerto Rico only. Valid on mix & match, shorts and graphic tees marked as eligible only. To receive Double Points, a My Place Rewards Member must make a qualifying My Place Rewards purchase during the Bonus Points Event in U.S. or Puerto Rico stores or at childrensplace.com when shipping within the U.S. or Puerto Rico only. My Place Rewards Members will earn 2 points for every U.S. $1 spent. Double points for each qualified in-store purchase will reflect in the members account within 48 hours. Double points for each qualified online purchase will reflect in the members account after receiving Ship Confirmation email. Points have no cash value. Must have valid email address and U.S. mailing address. Eligible purchase amount is the transaction total for merchandise and gift wrap products after any coupons or other discounts are applied, and minus any returns, refunds or credit adjustments, and does NOT include taxes, shipping, or purchases of gift cards. Cannot be combined with other purchase-based point offers, whether qualifying purchase is made in-store, online or within the app(s). Valid on The Childrens Place branded merchandise only; excludes sleepwear, Gymboree, Sugar & Jade and PJ Place branded merchandise. Excludes purchases of gift cards and purchases on The Children's Place, Inc. official mobile apps. This rewards program is provided by The Children's Place, Inc. and its terms may change at any time. For full Rewards Terms and Conditions, please visit childrensplace.com/rewards-terms. Valid 4/10/24 through 11:59 pm Central Time on 5/7/24. MY PLACE REWARDS CREDIT CARDHOLDER 3X BONUS POINTS EVENT Offer only available at U.S. and Puerto Rico stores and at childrensplace.com when shipping within the U.S. and Puerto Rico only. Valid on mix & match, shorts and graphic tees marked as eligible only. To receive Triple Points, a My Place Rewards Member must make a qualifying My Place Rewards purchase during the Bonus Points Event in U.S. or Puerto Rico stores or at childrensplace.com when shipping within the U.S. or Puerto Rico only. Cardholders will earn 3 My Place Rewards Member points per U.S. $1 spent with the My Place Rewards Credit Card. The entire transaction amount must be placed on the My Place Rewards Credit Card. Triple points for each qualified in-store purchase will reflect in the members account within 48 hours. Triple points for each qualified online purchase will reflect in the members account after receiving Ship Confirmation email. Points have no cash value. Must have valid email address and U.S. mailing address. Eligible purchase amount is the transaction total for merchandise and gift wrap products after any coupons or other discounts are applied, and minus any returns, refunds or credit adjustments, and does NOT include taxes, shipping, or purchases of gift cards. Offer is exclusive to My Place Rewards Credit Cardholders enrolled in the My Place Rewards program. Cannot be combined with other purchase-based point offers, whether qualifying purchase is made in-store, online or within the app(s). Valid on The Childrens Place branded merchandise only; excludes sleepwear, Gymboree, Sugar & Jade and PJ Place branded merchandise. Excludes purchases of gift cards and purchases on The Children's Place, Inc. official mobile apps. This rewards program is provided by The Children's Place, Inc. and its terms may change at any time. For full Rewards Terms and Conditions, please see childrensplace.com/rewards-terms. Valid 4/10/24 through 11:59 pm Central Time on 5/7/24. Credit card offers are subject to credit approval. My Place Rewards Credit Card Accounts are issued by Comenity Capital Bank. AFTERPAY DETAILS Late fees may apply. Eligibility criteria apply. See here for more details. Loans to California residents made or arranged pursuant to a California Finance Lenders Law license.  2021 Afterpay US GIVE BACK BOX x MY PLACE REWARDS BONUS POINTS OFFER Offer is available to My Place Rewards members. To receive bonus points, a customer must complete a Give Back Box donation following the steps set forth at childrensplace.com/us/content/give-back-box. Must have valid email address and U.S. mailing address. Bonus points may take up to 14 business days to add to your account after the donation is received. All bonus points will be awarded to the My Place Rewards Account that is associated with the shipping label created in connection with the Give Back Box donation. Bonus points have no cash value. Earn 100 points per donation for donations completed. While there is no limit on how many Give Back Box donations a customer can make, a customer can only earn points one (1) time per calendar week for a Give Back Box donation. Give Back Box donations in excess of this stated limitation will not be eligible to receive points. Cannot be combined with other Give Back Box point offers. Rewards program is provided by The Childrens Place, Inc. and its terms may change at any time. The Childrens Place, Inc. reserves the right to cancel your participation in My Place Rewards, in the event of fraud, abuse of rewards privileges, or violation of the Terms & Conditions. All applicable Rewards Terms and Conditions, available at childrensplace.com/us/content/myplace-rewards-terms. Valid now through 11:59 pm Central Time on the date included in banner above. BUY ONLINE SHIP TO STORE 20% OFF OFFER The discount will automatically be applied at checkout when Ship to Store is selected. Eligible items may vary. Available for shipments to select U.S stores only; not available for shipments to stores in Hawaii, Puerto Rico or Canada. Not valid in conjunction with The Childrens Place associate discount. Item availability not guaranteed. Offer is subject to change and/or termination without notice. Not valid for cash. Void where prohibited. MY PLACE REWARDS MEMBER POINTS BALANCE Total may not reflect all transactions in the last 48 hours. Please take a moment to add thechildrensplace@promo.childrensplace.com to your address book. This email was sent to erinsalik@gmail.com because you requested to receive marketing messages from The Children's Place. This email may be considered an advertising or promotional message. You can withdraw your consent at any time. To update your email preferences or to unsubscribe, click here. UPDATE EMAIL PREFERENCES | UNSUBSCRIBE | PRIVACY POLICY | CONTACT US 2024 The Children's Place, Inc. All rights reserved.The Children's Place, Inc., 500 Plaza Drive, Secaucus, NJ 07094, USFor customer service, please visit our contact us page or call us at 1-877-752-2387."	IN STORES ONLY! $4.99 ALL Graphic Tees!																																																																																																																																																												
"Consider yourself notified ?? view in browser *Prices are representative. Actual prices as marked. Compare At prices are based on comparison to the regular price of a comparable item at a full-price department or specialty retailers. Purchase subject to credit approval. 5% back is equal to 5 points for every $1 spent. See Rewards Program Terms for details. Styles vary by store and online.  2024 T.J.Maxx Please do not reply to this email as it was sent from an unmonitored inbox. Go to Contact Us | T.J.Maxx for options on how to contact us. To update your email preferences or unsubscribe, click here T.J.Maxx, 770 Cochituate Road, Framingham, MA 01701Privacy statement | Terms of use | tjmaxx.comGoogle Play and the Google Play logo are trademarks of Google Inc. Apple and Apple logo are trademarks of Apple Inc. registered in the U.S. and other countries. App Store is a service mark of Apple Inc., registered in the U.S. and other countries."	Alert: NEW ARRIVALS (!)																																																																																																																																																												
"Welcome to our growing learning community Our members have studied a total of 526700638 positions, and counting!Start a short study sessionHi hder03,We're so happy that you're here!With all the courses and features on Chessable, you might not know where to start. To make sure youre getting the most out of your chess learning, we recommend a few things to check out first.If you havent looked at your tailored tutorial yet, we highly recommend it! Its the first course on your dashboard, simply named Tutorial. In just a few quick lessons, youll be a pro at using the MoveTrainer software - the core of how Chessable works:Start your short tutorial here.Remember, to make the most out of Chessable, it is important to review regularly. Even if you can only spend five minutes a day, you will build solid foundations of long-term chess success. Some top resources for new members:Free opening courses: Free Short & Sweet CoursesFree Endgame Course: Free Endgame BootcampTips: Using spaced repetition intelligentlyScience: The science of ChessableSee you at the leaderboards!The Chessable teamCopyright  2024 Chessable, All rights reserved.You are receiving this email because you have registered for a Chessable account. Our mailing address is:Chessable, London Mindsports Centre,21-23 Dalling rd,London,W6 0JD,United Kingdom."	A Welcome Message from the Chessable Team																																																																																																																																																												
"From You Flowers Schedule Your Guaranteed Delivery for Mom! MOTHER'S DAYBIRTHDAYSYMPATHYUNDER $40SAME DAYMother's DayBirthdaySympathyUnder $40Same DayHELP LINKSCall: 855.381.7774Track OrderAbout UsCorporate ServicesPrivacy PolicyHELP LINKSCall: 855.381.7774Track OrderAbout UsCorporate ServicesPrivacy PolicyPlease add fromyouflowers@email.fromyouflowers.com to your address book or safe senders list.This mailing was sent to erinsalik@gmail.com because you signed up to receive our emails and exclusive deals.For more information about From You Flowers privacy practices, read the online privacy statement.If you no longer want to receive From You Flowers emails, you can unsubscribe here. Alternatively you can select a new email frequency within your Update Profile.Having trouble viewing this email? Click hereOffers not combinable with any other offers or discounts. Not valid on previous purchases, delivery, taxes, shipping or other fees unless otherwise designated. Discount is automatically applied at checkout. From You Flowers is not responsible for typographical errors.Promotional Discounts will automatically be deducted from the original price of each item in your cart. Offer is valid on all florist delivered arrangements. Promotions may not be available on a select group of products. See item-level product description for details.Same Day Delivery is available for all florist delivered arrangements sitewide when you place an order before 3pm in the delivery zip code. See item-level product description for details.This email was sent by: From You Flowers, 143 Mill Rock Road E, Old Saybrook, CT 06475, United States.  Copyright 2024. - - - - - - - - - - - - - - - - - - - - - - - - - - - - - - - - - "	Last Chance for 25% off Mother's Day Flowers!																																																																																																																																																												
"You asked for it. NewClothesBeauty & WellnessAccessoriesIntimatesShoesSaleYou are subscribed as erinsalik@gmail.comUnsubscribe Privacy PolicyFree Express Shipping for US and Australia orders over $150 valid on the Free People App. Valid to all US and Australia addresses for a limited time only. Express orders placed after 1 PM EST will ship the next business day. Express Shipping must be selected during checkout before completing your order. Does not apply to any duty/tax due on delivery.Free Returns on all US orders. Valid for a limited time only. Additional fees apply for Express and Overnight delivery options. Click here to view current promotions. View in a browserFree People Direct Customer Service5000 S. Broad St., Philadelphia, PA 19112  2024 URBN US Retail, LLC. All Rights Reserved."	The return of these ($78!) jeans ??																																																																																																																																																												
"You're the first to shop for 48 HRS. view in browser Eringet a 48-hour sneak peek! Purchase subject to credit approval. 5% back is equal to 5 points for every $1 spent. See Rewards Program Terms for details. Styles vary by store and online.  2024 T.J.Maxx Please do not reply to this email as it was sent from an unmonitored inbox. Go to Contact Us | T.J.Maxx for options on how to contact us. To update your email preferences or unsubscribe, click here T.J.Maxx, 770 Cochituate Road, Framingham, MA 01701Privacy statement | Terms of use | tjmaxx.comGoogle Play and the Google Play logo are trademarks of Google Inc. Apple and Apple logo are trademarks of Apple Inc. registered in the U.S. and other countries. App Store is a service mark of Apple Inc., registered in the U.S. and other countries."	Cardmember exclusive: EARLY ACCESS																																																																																																																																																												
"Dear Customer, Your A/C XXXXX553323 has a debit by NACH of Rs 1,000.00 on 01/05/24. Avl Bal Rs 4,05,643.57. Download YONO - SBIPlease do not reply to this auto generated email. For any query, please contact our toll free number 18001234 & 18002100."	CBSSBI ALERT																																																																																																																																																												
